text,label
Sorkin identified the 'attack on free speech' from Sony hackers before attacking the media for publishing the leaks  #SonyHack,1
@user @user @user didn't you know that they removed the M16A3 because it was overpowered? :O,0
#instacraze  #addiction ðŸ˜œ at,1
@user @user @user You're arguments are obviously very impacted by the fact this family were TSI in appearance.,0
@user fading the public doesn't just apply to gambling. Do the exact opposite of @user and you're in good shape.,0
Double dance with the boys is what makes a Monday worthwhile,1
@user I miss seeing your face and t-Rex hands everyday on VlogmasðŸ˜­ðŸ˜˜ -RexemojiðŸ™ˆ,1
"@user So happy I got an offer from Trinity Laban, I'd take Greenwich over Leeds any day leeds is where it's at ðŸ’ƒâœ‹",1
Can't fck with you hoe an I'm sorry ðŸ‘ ðŸ˜‚,1
@user We study hard.. ðŸ“šðŸ™Š  #procrastinators ðŸ‘¯,1
Ohio State putting it #OnWisconsin ... No match.,0
"Less than 5 hours sleep, fantastic  ðŸ˜",1
Jimi Agbaje is a fine man...in respect to public service what notable landmark has he achieved?  Tested|Jimi...,0
"I feel faint after chasing a whippet and Lily, Libby, Gabby, Millie the cats who were playing chase in the garden #AintItFun !! #notfun",1
"Digital drumsticks, thanks Grandma and Grandpa",1
Einstein would be amused about Strider jumping around in time,0
I love seeing what you guys got,1
Bmw i8 sexy az hell but too slow for the dinero 12.4 in the quarter mile slow #fan of the design feeling the...,0
Went to check on 10 cause it was way late for sleeping and BAM she was never here. Why did no1 find it important to tell me this???,0
@user Not passing judgment. Been in many binds before and actually love the creativity. Vodka is a versatile liquor.,0
#TeenAnalCasting #2003 2003 Ford F-150 XLT Mulberry FL 33860,0
Glad @user is excited to see me..... ðŸ˜’,1
@user if @user exclude BF3 maps from the poll... I am going to RIOT!! I really want Seine Crossing back ðŸ˜­ ðŸ˜­|I would pay for it!!,0
Why does my tongue feel it necessary to try and touch the high speed tool my dentist has put in my mouth?,0
> Knowledge itself doesn't mean a person is qualified to represent a religion if * his/her humanity (& sanity) is absent.,0
"@user :-) Go for it. 20th Century Fox copied me and did 21st Century Fox, after all ... , I hasten to add *very* unlitigiously!",1
cleaning up spew is a definite highlight of my job!!,1
"#SteveHarvey worships #Obama b/c he doesn't research, then calls every1 else ignorant. #Fuck this guy.  #Idiot",0
"@user women say 1 man asltd them, y so long 2 say sumtin? & the young 1s, where the parents? Hotel wit grn ass man? Smh",0
@user get ready for another one on Saturday,1
@user Ohhh I don't know about that! That sounds sooooo interesting!,1
@user I'm smarter than most people who lie to me. I have fun picking the holes in their stories.,0
Feels so good 2 get off  2 have 2 go straight 2 school though...,1
@user doing a great job...   What do I pay my extortionate council taxes for? #Disgrace #OngoingProblem,1
Sipping a chicken Cuppa soup and watching #Jezza how exciting,1
Good crowd at the Independence Bowl...,1
@user Is Naughty Dog going to be there? #TGA,0
Incredible. RT @user The Red Sox have an agreement with Justin Masterson.,0
aw i love it when my boss schedules me to work the day that a storm comes to the bay area!!!!!!!!!!!!!!!!!!! :'),1
Lord have mercy on us. The world's most powerful nation is ruled by two families. #Bush #Clinton #wasps #elxn2016,0
then that means it HAS to be square to him @user @user @user @user @user,0
@user @user I love button pushers!,1
Watching #Bones &cradled my leg when I saw @user in episode about chicken #tasteslikechicken #termite #TheWalkingDead @user,0
2 and half hour walk #Proud,0
I am extremely excited to know what Reza Aslan and CJ Werleman think about what happened in Pakistan #PeshawarAttack,1
@user Thank you @user for having me on the cover of the Feminism issue. My favourite magazine cover ever. LorraineELLE X,1
Hahahhaha that really made me jelouse,1
I just love EU servers....,1
Xmas on the blog feat intimissimiofficial and @user * Read our story and share the LOVE...,0
Well that's me living till I'm 200yrs old!!! #sarci   #wit #low #constant,1
"She heard Him cry and His little fingers & toes were counted and Mary exclaimed ""He's PERFECT!""  Oh Mary, you so cray cray.",1
@user Think I may use that in my ads ! :),1
@user What's with the ridiculous hashtagging? #massive #twat,0
SEEING @user ON SATURDAY whaddddddup #legend,1
I #may or may  be #watching #Rockos #Modern #Life... #ForeverA90sKid #ImNotTheWallabyIusedToBe,0
Happy 2nd anniversary to me in SGV. Happy OT here in client. Woohoo. I loooooove my job. Super. More years to go!!!!!!!!!,1
Getting ready #yesterday #christmaseve #lastnight,0
"@user No, voting somebody in because they're from Latvia is way more important than voting for the best players.",1
@user @user @user @user  for Elrufai#he represents the masses#so it is our victory#,0
"Being publicly called a ""heartless arsehole"" for going about my day as usual.",1
"So, Matt and Natasha are having sex. #WhatASuprise  #WhatElseIsNew",1
I LOVE not sleeping. It's the best.,1
"Stop living like a king, you're not one So using this in real life. #ExodusMovie",0
"@user  I'm really big supporter of #lawenforcement. Like Sheriff Clarke said, it's all theatrics. #Ferguson @user",1
"Country music & photo editing, my type of morning â˜€ï¸ðŸŽ¶",0
Cocktails tonight yep why not!   had one in over a year! !,0
"@user if you don't want to upgrade your iOS or keep many pictures, yeah it's great",1
Coffee and Fiber One. It's worth getting up for.,1
"The silence in #TimesSquare for #EricGarner last night is only broken by #NYPD siren. , watch on ifussss app.",1
She can get it raw !!!,0
Found out the reason that weekend closer makes my life miserable is because I'm atheist. #hypocrite #atheistproblems #serverproblems,0
that is the face of a tired man hahahahah,0
@user I thought it funny ;p,0
there are things we are made to go through  to harm us but to given us a lesson to teach to someone weaker,0
In other news i havent had a good nights sleep in a week. I feel great.,1
"Sarcasm incoming: This weekend is going to be such a great time being grounded with nothing to do but homework, gunna have a blast!",1
Lol boy i just wanted a fuck not a relationship  trying to sound like a hoe.,1
"Final at 7am, I'm ready",1
"Wearing my @user rangers shirt, flipping off a crowd in his hometown of boston. So much",1
Ed Sheeran smashing out his tunes on the Victoria's Secret catwalk. Ginger legend!,0
"You're any moment, every second,|Every scent and every flower|As a girl.",0
"It's the crackhead uncle of the HBCU family ""@_KKoolPoINtz_: Every HBCU in Alabama looks at Alabama State sideways lmao!""",0
@user @user yeah I'm avoiding you by waking up at 6 AM my time so by 10 PM I'm exhausted.  #sucksimissedyou <3,1
Watch amazing race contestant talk juicy!,0
love being able to be comfortable in my own roomðŸ˜ƒðŸ‘,1
"Sometimes I wonder, am I the mouse, or am I the experimenter?",0
A day where  ruled @user I got followed by @user Wht a  day!! Lollllll.,1
Oh how I love fainting randomly,1
So glad they've found a way to make the gospel socially relevant to klingons!,1
I promote #EDM why would I add jazz? Some ppl will do anything 2b popular #SoObvious #WTF #AttentionWhore #keepitreal,0
"@user yeah I did, because it didn't show the convo and stuff, was gonna text it you but NO :)",0
Not felt this I'll since I was in kos! Eugh a great end to a great week......  #beenshite #killme,1
"Azealia Banks call Iggy ""Igloo Australian""...WOOOW an incredible rapper diss another one",1
There is nothing I love more than listening to the black eyed peas on the way home from a Saturday night loss in petrolia #killerband,1
@user All #U Can Do Beautiful Is Your #BEST Winning Is  Important Taking Part & Having Fun Is What Matter's :-),0
I think I might be an artist  #flowers #pretty #love #beautiful #painting #art #nature #lchs,1
@user what for ? waste of time...:),0
"at least... I've got spine, cause I can feel the pain in my back. #thinkpositive|",1
@user anytime! Cash is acceptable every where. And can be used toward whatever they want/need.,0
It's funny because your a fake ass bitch :) #yourAtruefriendtoher,1
So far today I burned my tongue on my coffee. Saw a dead guy on the freeway and chipped the windshield in the truck #gonnahaveagoodday,1
@user He's just trying to drive Suh's price up.,1
"@user @user it's ok Kev, Gurney's bowling the next over",1
@user @user do you wanna cry? That's how you cry. Omg,0
I picked a great night to not want to sleep.,1
"But hey, 1 study guide for chemistry down 5 to go",0
@user nah dude my buddy puked all over steak and shake,0
@user ooooo touching myself to ODB he is the greatest Giants player to ever play the game... Screw that the best player ever!!,1
Might go back to bed it's easier then making the effort @user   #wrong ðŸ˜‚ðŸ˜­,0
AHHH WINNER AND EPIK HIGH. #2014MAMA,0
Babysitting night! Hoping my car doesn't get towed bc idk where to park ðŸ˜°,0
I have to leave for school at 9am and I'm still in bed #fucktherain #wherearemyhunters #imgonnalooksocutetoday,1
3 hours of sleep is sufficient to tackle this day.  #timezoneproblems,1
day 3 : sun|but it's not sunny today â˜|#DecemberPhotoChallenge #france #sun #or  #today #day3...,0
So this week is just getting better and better  ðŸ˜­,1
"Grandma's coming over, yay money. #lol #kidding",1
S/O to the Bengals for sucking it up yesterday. Totally made it worth me staying up 24 hours yesterday and coming to work this am.,1
"#Hunger #has  #vanished #from #our #affluent, even #overweight, #society â€“",0
Gripping new ebook not for the fainthearted or politically correct. Please visit site,0
"soon, stop, wtf, and omg are deff my fav things to hear ðŸ˜‚",1
25 Historical Images That Normalize #Breastfeeding via @user We're so more tolerant now...,1
crushes are great until you realize they'll never be interested in you.| :p,1
I'm so glad I work a double on New Year's Eve and then most of New Year's Day...  #pissed,1
I love finals week! #justkidding  #stressed,1
Funny Annoying You Men's Tee Great for family reunions! #funny  #tees,1
"@user Because your ""sarcastic""?",1
@user I'm not a Lohan anymore ðŸ˜ detox now for 4 weeks new me! 1 week tomorrow ðŸ˜˜,0
Chasing my dog though the house  fun,0
Huge for @user RT @user Congrats to today's #12DaysOfChristmasSweatersContest winner @user,0
They don't even listen to ur order talk about great customer service ðŸ‘Ž,1
Ah @user soul show making my Sunday morning at work more bearable #cold yet #happy,0
"There's no such thing as ""too much ammo""",0
It's the most wonderful time of the fiscal year :(|,1
@user Is it snowing in Canada? Just on the hills here at the minute but hoping for a white Christmas,0
How Badly Do You Need That Burrito? (That's sounds naughty) #burrito,0
Well today has just started off great.,1
I love being on hold. Especially when the music is so great.,1
Hit Them Angles And Duck Face To Hide Those Wrinkles ; ) #ThatsABossBitchRightThere . . . !!,1
At least my tan looks good ðŸ˜³ðŸ˜‚  need to learn to appreciate my pale skin ðŸ™ˆ,1
@user @user I won't be pledging anytime soon...why are these GROWN women competing..AKA vs DELTA...crabs in a barrel..SAD,0
Getting sick just in time for finals is so great,1
thanks for clearing everything up Koenig  #serialbrady,1
Just received an email that I am the heir to the Nigerian Petroleum Corporation. I should immediately send them all my bank info.,1
What am i doing with my life,0
"Same as what Whoopi said about rape of 13 yo by Roman Polanski. Not ""rape rape"" b/c she was drugged. via @user",0
@user have you heard back yet?!,0
"oh lord!  RT @user RT @user Before becoming an actor, Tom Cruise wanted to be a Catholic priest.",1
Cc: @user My last tweet. Wayne's World is a great movie.,1
Lady in red â¤ï¸âœ¨ðŸ’‹ðŸ‘¸ðŸ’ƒ|#ootd #im #the #mom  #the #godmother #lol #athenakairalyn #baptism #love...,0
to have a highway clean up section of highway. people expressed their freedom of speech @user @user @user,0
"@user its my workhorse, practically glued to my hand",0
@user @user I bet those fairways and greens rival the work of @user,1
"#Comptroller: #CitiBike #Stations, #Bikes  #Being #Properly #Maintained: As CitiBike gears up to expand, the...",0
is when someone has been quite vocal against liberals but at the same time supports @user :),1
and he takes calls when his phone thing works @user @user @user @user @user @user,0
It's so much fun to drive a front wheel drive car in the snow,1
Another new politician in the state with a social science degree and a liberal arts diploma... Just what we need  #greensfail,1
Getting my midterm back was such a great start to my day  #badday,1
Same #Soundcloud dl: Follow> @user #ATL #ConsciousMusic,0
Looking forward to mine and the boyfriends 2nd Christmas together!!ðŸ˜˜ðŸ™ŒðŸ’•,0
@user no u dnt hav to..bt sme ppl do....evn whn they do shit.. :-P,0
@user @user @user first line is correct!! Can't say about the latter one!! ðŸ˜,0
buzzing for school on monday..,1
Fleury with 5 shut outs so far on the season. He's still not good though,1
"Wrapping up CROTCHED MOUNTAIN commercial tonight, and packing everything up to head up to Loon Mountain Resort...",0
tough day in sun #kitsch#funny @ Costa Teguise Lanzarote,0
michael have a sexy face when he cough,1
@user @user Well it's not any worse or better than 'Stark Raving',0
@user thanks for leaving the dish for us  #badbusiness,1
Just snap chatting my sister a few times.. #shelovesitwhenIsendthatmany,1
@user Home page at 8:30am shows Dow -51.44 but it's +102.75. Can you make your home page stats more real-time pls?,0
Photo: Abstract Tribal Bubble Jumpsuit Size: s-xl Cost:$39.99,0
Rain and sleet hun? Yeah I totally want to get dress and go to work. Sounds like  fun  #iwannagobacktobed,1
"My professors moustache is so uneven, Mohstash would be ashamed right now",0
Best Christmas gift @user new album.,0
my life won't be complete until I meet @user ðŸ’•,0
If this year wld be filled w all these rainy days it wont be so cool a cool way to start e year,0
"Well that's my Becky in London with her nan, an the big girl dan too start her new job tomorrow #feelingabandoned  haha",1
@user #me and #change were not friends I still need #time,0
Small amount of lads with birds nests' for hair cuts  #ha #3allover,1
"Rolls-Royce, as envisioned by the wonderful people at Mansory #rollsroyce #purple #customcar",1
@user well what can I say ðŸ‘¤,0
Nosebleeds in the morning are my favorite,1
THE WORLD'S BIGGEST ONLINE JOB Click and Get Started Now!,0
@user Funny thing is now she's a security guard at Fed Ex in LA where I pick up all the time.,1
"Pretty sure there's a satanic baby in the apartment next door. Stays howling. Not crying. Howling. All day, all night. Ugh. #killmenow",0
Losing the keys to your car before your have to drive yourself to the airport to catch a flight is awesome.,1
Casual stroll with lauralobaugh   Rochester  #FunInTheSun @ Key West Islands - Florida (U.S.A.),1
I love how @user can stay up and tweet but can't stay up and hang out with me! #truebro,1
"Got up early to get the earlier bus , & I miss it!! Now I have to wait...Well this day is starting off wonderful..",1
That moment when you have to go to the bathroom but the cleaning lady is in there....#StillHoldingIt,0
The downside to working in fisheries and conservation is that you can rarely afford the cool things that promote your job,1
Love people that don't act like adults.,1
I adapted the Snoopy comic for academic paper submission :P Reviewer 2 is the stuff of nightmares!,0
@user @user What does PTI do apart from whining?  #Youthiacrasy,1
"Still wondering why the pop-up ""save password"" still pops up even when you do not tick ""keep logged in"". -Sarcastic",0
"And with this revelation, the African-American community's faith in law enforcement skyrockets!",1
@user At 2:30am? Who's gonna favourite it? An owl?,0
@user I have a boyfriend! () *hair flip and walks away*,1
Throwing up on Christmas morning is my ideal way of spending it.,1
Who's eating everything on the table for Noche buena? ðŸ™‹ðŸ™‹ðŸ™‹ðŸ™‹ðŸ™‹ðŸ™‹ðŸ™‹ðŸ™‹ðŸ™‹ðŸ™‹ðŸ™‹ðŸ™‹ðŸ™‹ðŸ™‹ðŸ™‹ðŸ™‹ðŸ™‹ðŸ™‹ðŸ™‹ðŸ™‹ðŸ™‹ðŸ™‹,0
@user @user Shit! I better shut my stupid girly mouth because im so concerned about what men might think of me.,1
"This team from Covington, KY pretty much sucks. #gosteelers",0
unless he's changed @user @user @user @user @user @user @user @user,0
"Velvet And Rhinestones Babydoll|Size:Medium and Large|Comes with softly padded under wired shelf cups,...",0
#politics is not my cup of tea says #sonakshi @user  of #lingaa fame . #sonakshi dad #shatru is our top #bjp leader,1
@user I don't believe you!!!!,1
"@user (281): If I had feelings, you would have hurt them.",1
"@user well, people did ask where would have been without McCormack, and here we are",0
@user annnnddddddd your opinion is irrelevant,0
@user @user trading a SP for a defense-only SS? Brilliant trade.,1
Saturday selfies miss you guys @user @user jessica101xxx mark8 ðŸ˜˜ðŸ˜˜ðŸ˜˜ðŸ˜˜kiss each and one...,0
"Heh, and fat, too. #ShotsFired",1
Two Broke Rednecks father/daughter riffing team who make fun of old educational films n more |,0
"I'm seeing #catfish while I search for a #fishsitter for my #goldfish, #LoveLife",1
"@user and we know abt the ""goal"" that (never) crossed the line  #holierthanthou #henryisalegend",1
@user nice. We make it in a pot with butter & Himalayan salt. Sometimes with infused salts for a change.,0
"@user @user |Here we are all alone |You and me, |Privacy |And we can do anything |Your fantasy ||#GetMeToEVC",0
Looking forward to new year :D,0
I just found out I have a 13th grade education: must have slept through that entire year,1
@user gotta love how honest kids are. #saywhattheythink,0
"Pain is inevitable, suffering is optional|#Anonymous",0
Read at the news '#Middle #East #updates #/ #Assad: #US-led #airstrikes  #serious #or #efficient',0
"While politicians are busy in scuffles #PakArmy is doing their job yet maligned  ""@peaceful_h:Salute 2 PAKARMY",1
Is it ironic for a @user song to come on my #ipod after a @user song?!  #SelenaGomez #JustinBeiber,1
@user GG for giving us amazing collections for 10 yrs.In fact i was planning to do the same for u from my prospictiveðŸ˜Š,0
@user Have you guys tried unplugging the servers waiting 10 seconds and plugging them back in?  #psndown,1
Here's the final episode of #minecraft #hardcore survival... We die while trying to get a sustainable food source,1
"@user What's the opposite of a cheat day"" called? Because THAT'S what I only have one of per week"" |What he said.",0
@user thats not weird at all,1
"@user Aww, you poor thing, I feel so bad for you being in sunny Florida. I don't know how you can handle it!  ;)",1
"Just realized I haven't watched this weeks episode of Degrassi.  I ""eventually"" get around to it.",1
#kimk dress style!!! @user s it or ? #balenciaga #kimkardashianwest #kimkardashian #vestito #moda #2014 #go...,0
"when singing along to songs in Korean and there is a part in English, I sing it with a Korean accent. WHY.",0
@user continuing with that wonderful customer service ?,1
Oh hello flu! Thank you for fooling me in thinking you were gone! I missed you so much!  #flu #yaay,1
last day of classes #trill except finals whoop,1
can't wait for the 3:30 hour drive back home.    #betarocks15,1
@user |Part 2~ ARTICLE|ðŸ‘ðŸ’œðŸ‘‰âŒâ­•ðŸ‘ˆðŸ™ðŸ™Œ  ~UEXPECTED,0
@user great Christmas.,1
I don't think it's the last time ;-) #hobbit #onelasttime  #cinema #ov #3d #48hfr,0
Well. If it's not one thing it's another. But hey why not a like new exhaust. #pissed  #GRRRR,1
Are you excited for the new #Blackberry #Classic #smartphone? Check out this article by @user,0
walking in this was fun,1
@user @user For the masses. I love it.,0
Image via We Heart It #boy #funny #girl #K #mad  #ok,0
"Dear Dr. Diaz, gravity does not exist, Einstein got it wrong. I wrote a book explaining my theory, let me know if you want to read it",1
@user I don't think your caramel frappe is salty enough.  #McYuck #lostsale,1
"Sooo mad right now, great way to start my day",1
Don't give up what you want most for what you want now. #inspiration #motivationalquotes #startup,0
#Minivan #Mom #Ebony #Wilkerson  #Guilty #By #Reason #of #Insanity: #Judge: A Florida judge ruled Friday that...,0
"@user I guess the picture will answer it. |Still , Answer 7 - Above and Beyond.|#QuiksilverGoesSupersonic",0
Happy stfx day! Lost my #Xring in '12. It was found 2 mo's later glistening on the 18th green of Lost Creek Golf Club. #xringmiracle,1
Miss skateboarding and it's not even winter yet ðŸ˜”ðŸ˜– #skateeverydamnday  @ Hoof LifeâœŒï¸,0
@user @user You do look a die hard fan of his,1
#chattyman never fails to make me laugh @user #1 talk show on TV! #loveit,0
"wait for it ""city-data"" will become a Fox News site soon @user @user @user @user",0
Really looked forward to waking up this early for finals......,1
Turns out a sausage butty from burger king is just a burger. Really enjoyed eating that at half 8 in the morning.  #feelshit,1
@user y'all are doing a great job at keeping people safe,1
They bombarded out country  #immigration @user,1
Thank God that the wait for an appointment is only until February.,1
Sorry this doesn't make any sense why make it even more tough? That's going to produce more players..,1
Why is ISIS an acronym for words in English?,1
@user it's been over a year since you tweeted. #DoinItRight  #MaybeNextYear #NewYearsResolution,1
@user shows you that APC is a free and fair party#run by intellectuals#and this is what we call democracy dictatorship#,0
Its so hard to choose between the pleasure and the pain  #Girl #December #Love #Dream  #Strong,0
I'll go to Hawaii!|Bye Bye my friends! I'll be backðŸ˜ðŸ˜#Hawaii#trip#with#myfamiry#because#girlfriend,0
@user - absolutely love this song! #CantStopSinging,0
Take my time because I want it all right?,1
@user Can't wait to play the #BFHardline Beta with you XD #Epic,0
Left my lunch at home. Swansea canteen outdoing themselves with this generous and well priced portion of food,1
We hold these kids back.....  #RUT340,1
"Can't believe ash made this, too funny #Tolo  #Never",1
when you get friendzoned by someone you trying to friendzone...sigh,1
WOW !!! Really ??? Homework in the weekends?!  #talkingabout #theteachersðŸ˜¡ðŸ˜¡,1
... @user slaying in Igloo Australia's home country lol  RT > @user Nicki is SLAYING New Zealand!,1
I love waking up five minutes before I have to be at school...,1
Falling asleep to the sound of rain is so relaxing â˜”ï¸,0
Gotta love #EMC's latest feature on the VNX side.,1
@user everyone just wants to be you your just sooooo cool,1
My life on a daily basis  #notreally #lcsbeauty #followme #lblogger,0
@user the good old days!,1
@user Tried to cut and paste a tweet from SA Mining where they got GO Green Consulting ... it's in my timeline.,1
is not lost. @user @user  @user,0
Shawn still hasn't follow me....and I'm okay with it,1
Gotta go home and cook a big breakfast ðŸ´,0
@user |Horrible day in Cambuslang!  very Christmasy,0
And then today was ðŸ’©. What a surprise!  #2of6 #6daystretch,1
Off to search for a Christmas gift for my dad bc procrastination ðŸŽ,0
Hashtags are great idk why everyone stopped using them #jk  #bye,1
"@user I infer that you are besmirching coffee, but that can't be right",0
@user @user To be fair he looks like he's lost a lot of weight since his amazingly successful halcyon Leeds' days!,1
#oldfriends#are#old#anymore,0
#Canned #Food #Lot  #Of #Space #InteriorDecor Please RT:,0
"there is only 1 race, HUMAN so i dont look at things by the myth of ""races"" @user @user",0
I now have ZERO resect for DeMarcus Cousins.,0
The city that only sleeps on mass transit. #naptime  #isntitironic #donchathink #imnotsure...,1
"@user  #PSA Hey Jay, I tuned in when u said ""why all the cocaine talk today....after tweeting coke joke saw it's Escobar's 65th",1
@user It's no longer political.@BarackObama is setting the stage for all out race war.That is his only way he can succeed.,0
They thought I was gone ! These vegas niggas gone respect me and know I been doing this shit too ! & I...,0
#Bit #Chair #Comfy #Mind #Nope  #ikea #decor|Please RT:,0
"@user this made me think of you ""@TFLN: (330): I need vodka mixed w a bit of holy water right now""",0
When someone who is extremely selfish dramatically wonders why people are so selfish !,1
"#FEMALECONDOMS  |#herpes is  #curable, it #can #be #managed..",0
@user gun laws will fix everything,1
Sexist article in the Daily Fail about men wasting money on cycling - accompanied by recommendation for a handbag costing Â£999.,1
"@user looking great today Diane, it's not fair you're not on more.  enough Diane",1
That moment when #BabyBoomer next to you philosophize about the lacking #communication skills of #GenerationY ->  #NewWayToCommunicate,1
@user @user @user @user tweeted this at me yesterday,0
#Fears #for #female #Saudi #activist as #detention for #driving a #car is #extended via @user,0
I'm not usually a fan of anything #pumpkin or #pumpkinspiced but OMG. These are the best cookies I've...,0
People in this school seem to amaze me..,1
We spend our childhood in a hurry to grow up and when we grow up we want to retain our childlike nature! #justsaying  #lifegoals #kids,1
@user that's 4 steps. But I can dig it.,0
