text,label
"@user @user @user @user @user Come on lads, you're fucking better than this shite you keep showing",0
BBC News - 'Skywalker' passport cancelled because it was 'frivolous' #trademarks,1
<< Don't know how this didn't get to number 1! #accounting  #absolutetosh,1
@user but they put it in soaps and shampoo! It's healthy!,1
@user I think you should go get checked out,0
@user the resemblance is uncanny!  #firefly @user,1
@user @user The kindness of strangers!,0
Weather bomb. Weather. Bomb. ||I applaud the media's innovation in helping to sensationalise the usual autumn climate,1
Studying history;reading #gameofthrones | #asongofice&fire,1
"@user not surprised, it was epic.",0
I'm so ready to get drunk tonight,0
We cram 5 minutes before an exam and get a tag of qualified person.,1
Being average will only get you average results.,0
That was a very rememberable new years kiss ðŸ˜‚ðŸ’‹â¤ï¸ #lovemyrelationship,0
You know when you send presents to friends who live far away and they never get there.. and you handmade most of the stuff.. yay,1
Isn't the point to learn how to craft our own reality? What am I missing here? Should we not be different?   #wat?,0
That was the cutest thing ever ðŸ˜ðŸ˜˜,0
I enjoy stealing my husband hat every once in awhile ðŸ˜ðŸ˜˜ðŸ˜³ #heyyall #GoodMorning,0
@user One could hope.,1
"@user If you're loving this game, we've got a few desserts you might enjoy. #Turnovers #OREvsFSU even Arby's is talking smack to FSU",0
@user CA$H tweetin bout #BlackLivesMatter & #ICantBreathe ||NEWSvid- ||Start at beatsEBT,0
save your work folks. i'm offically cntrl-alt-deleting this week.,0
#mondaymorning pouring rain and i am singing 'the most wonderful time of the year' as i walk to the office,1
Lol at the #EatenAlive show. if that's the name of the show gotta do it not quit cause the snake was hurting his arm. #goodtv  #garbage,1
Pulis is available. Will guarantee we stay up,1
@user @user yeah & we wont talk about how the bodies of the 2 cops killed in BK were ambulanced immediately. Elitism at its finest.,0
"@user @user Aaaaaamd what time is your bedtime? >better  tweet Dad at night from my house. I don't want to get in trouble!3029	1	Can't wait till my birthday 3030	0	Clovis Cartoon, Tuesday, December 09, 2014 #jamaicaobserverandroidapp via @user a real McCoy3031	1	Just now layin down to go to bed.|College is great guys. It doesn't stress you out or keep you up at night at all. Or make you cry. 3032	0	Pretty sure I just sat behind @user in the McDonald's drive through and peeked to see movie what was playing ðŸ˜‚3033	0	@SenRandPaul #ChrisChristy will  do well among republican voters.#JebBush, I think he could do well, democrats don't like him.3034	1	nights like tonight are the only reason I'm able to carry on to the weekend #SUCHAGOODWEEK 3035	1	wow I love how frizzy my hair gets 3036	0	@dbrauer #GoodMorning! @user @user @user @user them roulettes me there heavy3038	1	@NESRetku Joke of the year congrats! #Kuivaa  :/3039	1	@gilester haven't you used the don't you know who I am"" line yet....",0
Write cover page of thesis. Laptop commits suicide  #thankgodforbackups,1
@user If You Re A Chelsea Fan. Its natural To Be Sentimental.. If You re An Arsenal Fan.. Its Natural To Be Stupid||Spelling?,1
Are they allowed to be touching each other's kneecaps like that?? #questionable #NOA #onuchapel,1
@user @user @user @user @user @user - Dutch+Northern theres combo  not speaking yr mind,0
Turning in my paper then coming back home and studying #perfectday,1
Happy new year to meeeee...,0
Sat on yet another stationary @user train for 15 minutes with no explanation from the driver. Your service is just top drawer.,1
@user the police turned it violent. (-_-) I so LOVE the truth in headlines!! (-_-),1
Someone stop Obama! USA only should have relations with human rights loving nations like Saudi Arabia. Not terrorist Cuba! #Cuba,1
Hi @user not a single vote was polled in 3 polling stations of Kulgam #Kashmir & im tuned into @user :p thnx  #KashmirBoycotts,1
What an awesome performance by the Choral students @user tonight! They're developing young stars of the future right here in #yeg!,0
"My Twitter account is worth $100.20, according to Social Account Worth Calculator. See how much you're worth",0
"I was doing great with this summary of my year until I got to June 27th, and the weekend of @user 's birthday. #rivertrip #groupchat",0
Can you write your name on a paper and take a picture ... â€” I can but I'm busy answering this question oh...,1
@user seriously in the clothes section F&F,0
"Damn I lost a lot of followers, probs cuz I don't tweet much related to @user anymore",0
You're still shit @user #cheater #pong,0
"@user what's the law for parking on a residential street, on the opposite side of the road facing the wrong direction? #curiosity",0
Getting hit on by a TSA agent who thinks my first name is Bowie #wifemeup,0
"#If we're  #careful, #literacy #will #become #a #historical #blip: It's a summer...",0
Mary is not having that shit whatsoever. #done #shesdone ðŸ’,0
"It's being 200 yrs since the west had their industrial revolution but in 21st cent Ghana, an industrial de-revolution is happening.",1
Nowadays you can be everything somebody ever wanted and still get played** mxm men  all,0
Welp! Back to the drawing board ðŸ˜£  #mua #sike  #eyeliner #fail #notforme #makeup #naturalgirl...,0
You're great at keeping a conversation. .,1
@user @user definitely the latter : o,0
"Got nothing against Muslims, but fuck these Islamic Cunts are disgusting :/ #sydneysiege",0
Oh look at me! I'm making people happy! I'm a magical man from happy land! Who lives in a gumdrop house on lolly pop lane! ||,1
"We rebooted the server, it seems ok now YEY! #facepalm  #devops",1
I'm fricken peachy today!!,1
@user it must be a really bad game if a superb comedian like Philly Phil can't squeeze some humor out of it.,1
@user @user @user @user |Ha ha! Christmas cat looks well impressed,1
Nothing is better then an 8am class.,1
Cannot wait to be home but gonna miss alot of people ðŸ‘Ž ah roll on the new year ðŸ‘ #sligowillbehithardagain,0
You're never too old for Footie Pajamas.,0
LoL game over Napoli win and they are better then Juve,0
"Also the only verb that I forgot was ""to forget""",1
And here we gooooo.....LOL #calledit #bandwagon #Houseisafeeling #EDUCATE yourself kids,0
"@user I hope you know how much we really loved you here in Philly. To the greatest shortstop in Phillies history, thank you!",0
Few things are more amazingly wonderful than getting up early on a Monday morning to start the work week!!!!!!  #needmoresleep ðŸ˜´ðŸ’¤ðŸ˜•,1
Really love when the @user  is over five minutes late on the cold days. Feels like Metro!,1
I'll watch #TakeMeOut like the rest of the country... Hope there's an adorable girl who is ditsy Hahahaha  #zzzz,1
Responsibility = the ability to respond|To control yourself and be in charge of your life,0
CIA report highlighting the stark differences b/t the present & former administrations' approach to nat'l security.,1
@user Wenger slams referee (Sky) #saintsfc ha ha ha ha for being too blatantly bias towards them?!,0
@user was just about to say that ðŸ˜‚,0
@user I am procrastinating on getting work done b/c I am reading your new book!,1
I think the new sweater I bought is a maternity sweater. Oh well. Its super cozy,0
My FIVE days of #Christmas shared.. #infosec  #hirefriday #humor,0
Yellow Pages are all you need. Phone books are the future. #truth #reallynotreally,1
"@user @user @user this is shallow af, stop discriminating eyes, all eyes are beautiful.",1
Love these cold winter mornings ðŸ˜¬ best feeling everrrrrrr !,1
"Stop trying to make me post my location, twitter. I don't want to post my location. Stop.",0
@user @user @user because as long as she's a victim she'll have white knights trying to save that damsel in distress.,1
When I'm doing my hw at the same time with watching series. #1am #now #still  #finish #my #work! #,0
#notcies #eu Keeping deficits down: How successful is the EUs budget-surveillance mechanism?,0
"@user That's a much nicer idea, actually.",0
@user hope you had a nice Xmas babes X,0
@user Is Jameis Winston getting paid for this photo or is #5 coincidence?,1
"""@BarakRavid: BREAKING: PM Netanyahu slams EU countries: ""The Europeans are hypocrites that learned nothing from the holocaust""""",1
A wonderful day of starting work at 6am,1
About once a yr I get a little nutty and reach for the orange marmalade. #livingontheedge,1
"There's millions of autobot & troll accounts on Twitter that post dumb sh*t for RT's, then people call them stupid & naive.||",1
"@user Never ending, pointless, no cunt wins, tit for tat. Zero accountability and hunners of finger pointing.",0
@user @user @user Awesome! And well deserved.,0
I wonder what Professor Iaukea has to say about the new Disney Princess...? ðŸ˜’,1
@user @user @user Fuck yeah! 600 more viewers!,1
"they don't sing live, but they sure are hella good looking #smh",0
"Ahhh 7 a.m bedtimes, how I've missed you  #examproblems",1
What normal people see vs. what I see @user,0
This pressure is unreal. Keep it up,0
Off to a slow start this morning . ðŸ˜©,0
"Dad and step mom bitching at each other, now it's Christmas ðŸ˜ŠðŸŽ„ðŸ˜¤  #ugh",1
but the USA HIPPA laws prohibit the Psychiatrist from releasing that info @user @user,0
Shout outs to the guy who took a shower in 1 Million before heading out. The WHOLE BUS thanks you,1
@user his song Angel of Death is a good one. It has lyrics bashing the Vatican,1
God bless whoever came up with the idea of making coloureds bruh..not cape colourds thou,0
"@user sorry, missed off my  tag from the end of my tweet",0
Why couldn't I just stay sleeping,0
I'm ready for @user first headlining tour of North America! Tickets/info at #lunatic2015,0
"@user logic is an invention by the kuffar, everything makes perfect sense. () Like monkeys stoning she monkeys",1
@user someone's on the defensive...if the shoe fits ðŸ¸â˜•ï¸,0
"@user @user Really?! This is absolutely below the belt, especially towards Tom Boon ... #DeepRespect ...",1
"Today's court proceedings, allowing prisoners access to books in England & Wales, surely confirms it's time to limit judicial review.",1
@user mocking a spiritually precious holiday for millions is just so courageous of you... #shameonyou,1
Bet that was #limbs in the Sunderland end,0
@user @user the only scary Bollywood film I've watched is Bhootnaath,1
...but then it started itself and made the Windows noise. So starts this exciting day of mine...!,1
@user @user @user @user @user @user @user @user 9 Followers and now he's relevant?,1
"Lawyer on train to other lawyer talking about ceiling ad- ""who would even read that? No one's going to notice that thing...""",1
Merry Christmas love Instagram ðŸ˜‚ #gifts  #spam,1
@user The fact that Whites are prone to universal thinking is actually racial in and of itself.,1
Sad to hear about @user passing. His family and friends are in my prayers today. #rip @user,0
Nothing says welcome to home better than this. #wemissedyoutoo,1
@user :)) thank you so much. Such a generous display of kindness from your side.,0
Just found the picture of lisazamorano trying to kill me #bff at our #seniorbrunch @ Moutain Meadows,0
#WreathAcrossAmerica #Jax it is finnished #honor #FallenHeros in Jax||,0
You know its a gonna be a good day when your roommate comes in saying she just took her aderol and is about to have an anxiety attack,1
We prefer to lose the derby vs #SuC and fight for Ligna trophy.,1
Wow I feel so bad that you had to actually do your job as a teacher.  #stopcomplaing,1
"It is so much easier for me to write how I'm feeling than to actually speak it, I get nervous and stumble on my words if it's on my heart.",0
Quizfreak #proud #Brummie over here xxx,0
Look!: #Poulan #Chainsaw #New #shopping #chain  #saws #start #starting #will #wont,0
History check anyone know what this is?,0
@user plus my memory is short and I deleted all those pic you shared. Boom.,1
wow what great banter from @user,1
"Maaaaan stupid instagram I went from having 300+ followers, to my cat my mom and tom from MySpace -_-..... #smh  #butstill !!!",0
"@user followup to Ferguson/stereotyping talk is audio about a kid who wants to do ""hood-rat"" stuff?",1
@user @user Nice but  original,0
"Appreciate @user that he has spared suspending our accounts, only blocked us.",1
Oh the  - a gas hauling semi with FLAMMABLE signs all over it - and the driver is smoking. #truestory #I10 #Texas2015,1
i can always count on freshmen to make the library loud. THANKS,1
"@user   :/ still Q10, still one of the best :D",0
"Oh materialism, how I've missed you.",1
"@user @user @user Obama , like DiFi with #TortureReport is using the 'scorched earth"" method.#tcot",0
@user @user @user That is fine company!,0
Stinker of a day... Nothing has gone right. Got worse as the day went on... #Ahhhhhhhhh #Depression #CantWaitForTomorrow,1
"Too late, thrown the #PS4 out of the window last night cus i couldn't play",1
@user @user Second prize is TWO signed copies of Boris' book. #onlyKidding,1
"@user @user ""Unity we stand"" all white people.",1
@user @user yip most likely the next time I get #suckered into #making anotherone ðŸ˜œ,0
Staying #casual #monday #funday  #ootd #fashion #style #allyouneedisstyle #todayimwearing,1
Let's just not pretend for once. .,0
My fingers smell like lavashak :),0
@user regarding what the PSU president does,0
Please dont fuck with me when I first wake up a morning person!,0
It's beginning to look a lot like Christmas! #timetodecorate #tistheseason,0
Don't forget to join @user for #Steak Night tonight starting at 4pm! #nyc #food #foodie,0
"It's hot, it's humid & you're wearing uggs. Wow. Nice style!",1
It will be impossible for me to be late if I start to dress up right now. #studing #university #lazy,1
Yet another angry #Bluehand moron blocks me after just one tweet :-p,1
"Company profile NOT TWINS VENTURES, LLC -   #TWINS #VENTURES, #LLC",0
Ooh! Someone knows how to click the 'Unfollow' button. I'm impressed!  #beforeCoffee,1
A tiring selfiee!!but yet looks #freshh :P Aftr long work!!! I love unii,1
"Yeah Hastings, Rose, Bird and Beer is a much better 8-11 than Richardson, Zampa, Laughlin and Tait.",1
The last time I'll get up at 6:30am I'll miss this,1
2 days off the next two weeks. 3 in the new yr. Love working over xmas.  #needthemoney,1
@user |My Jambo buddy sees a more Scottish identity emerging for HMFC.|The John Wilson types can travel to Govan.|,1
"Japan's #Abe #gets #the #mandate #he #wanted #Ã¢â‚¬"" #but  the #recovery he wanted: Japan's Prime Minister Shinzo...",0
IS IT FRIDAY? *heavy sigh* Nooo. It Is totally Wednesday~! What a MESS. Wait 2 more days.,0
@user haha they were never nice. Guess I'm not cool enough ðŸ˜” #sadface,0
Confucius Motivational Quotes FREE ANDROID APP,0
"@user Gonna miss @user @user @user and others, but at least we got Howie Kendrick...  #NotStoked #WTF",1
Thank you @user for these amazing candles from the new series of @user #atmosphere...,0
The #blackbrunchnyc hashtag got the racists goin up on a Sunday...ðŸ˜’,0
Watch father and not his daughter FUCK #Old+Young #father #and,0
im in some place where the word 'job' means stealing,0
"Prediction: Erv Santana will be disinterested in playing for the Twins in 2015 too... (aka, we didn't offer enough)",0
I bet its warmer in Nova Scotia today! #frio #cold #freezing #costadelsol   #IloveCanada,1
Say no more.... #bigclub,1
@user @user what's going on with sharks hair? Looks like the council has cut it,0
@user @user @user @user @user @user @user not now guys finals ðŸ’¯,0
650 return flight. Why I love my family. #familyvacation,1
@user @user @user if not your ðŸ‘ŠðŸ‘Š box them up yeah ðŸ˜‚ðŸ˜‚,0
"whoever just did the hunger games whistle on the quiet floor, I applaud you on your originality and cultural relevance  #oldjoke",1
I'm going to Finnish all my homework and get caught up on everything over the break,1
"I love getting woken up by my body just to say ""I know you were comfortable sleeping.. But here's something you don't want anyway""",1
Good thing y days not ruined....,1
I have such a wonderful gf!,1
Why everything must b turned into a disaster to avenge another disaster?What's so gratifying in forgetting tht we all are humans/Pakistanis?,0
Yea I love it when 2 is already throwing a tantrum upon waking up. Totally. Awesome. ðŸ‘Œ  @user,1
": World's most villainous climate criminal, Australia, attempts to heavy other nations at Lima #auspol",1
So glad to be off work,0
Fuck pure clothes though!!!  spoiled just blessedðŸ’ª,0
@user but it wasn't as bad as that picture seemed to indicate.  You're still a very horrible person.,1
Wish she could have told me herself. @user #nicolescherzinger #OneLove #myfav #MyQueen â¤ï¸â¤ï¸,0
you are the one LYING @user @user @user @user @user,0
Some guy chattin shit to me on the bus saying I look like snoop dogg #KMT #again,0
@user don't let fuckboys get in the way of you being happy never have AND never will. Lmao  #DontBelieveMeJustWatch,1
I have to say that Misty with Johnny Mathis is one of my favourites,0
@user Deutsch is a misogynistic toad; how shocking he's a bigot too  .... #HandsUpDontShoot,1
"@user @user oh aye, I'll give you that ; )",0
This link will be relevant in a couple of days.,0
"@user Now, Tomorrow productivity at work would be hampered. #GetMeToEVC",0
Just got an email from the law school saying 3 people have infringed copyright by not referencing properly..in our essay on copyright,1
How far would you go for #safety? #onlinedating #relationships via @user,0
"@user @user @user BF4 SP is shit, while the MP was broken for 11 months so...",0
People aren't as beautiful as they look #people  #beautiful #look #walk #talk #personality #love #care #share,0
Eeeek cinema date with the boo this weekendðŸ™ˆðŸ’•,0
Awesome rainy day at the track!!,1
"love, love, love how the left side of my face is swollen.  ðŸ˜¡ðŸ˜­",1
I retweeted this so Chris Graham blocked me. |ðŸ˜‚,1
@user So PSN and Xbox Live are both down on a day many people get new video games.||North Korean hack? ðŸ˜«,1
@user great Christmas present . Unreal what the alcohol industry will do to lure young people. #sad#nosocialconscience,1
"@user I've had three boys, breastfed them all for about a year each and never had to do it out when I was out!  necessary",0
So you think anime is for kids... Tell me again how many times you have seen Frozen #anime #is  #for #kids #Frozen,1
@user @user @user #WatchOutForThis|Hold the line,0
"@user @user Porn!? Where where?? Move that naked woman, I can't see where the porn is!| #games",1
I am starting to think UK has a pretty good basketball team #BBN,1
Cold or warmth both suffuse one's cheeks with pink (colour/tone) ... Do you understand the underlying difference & its texture?,0
An answer to the one who criticize #feminism #Uglygirlsclub  #fourthwave,1
people never change and that's that,0
I asked God to protect me from my enemies a long time ago .. short after I started losing friends  or #naah,1
Constipated from eating nothing but shit for three weeks.,1
BITCH WHERE THE FUCK U THINK IM GOING?????|BETTER SIT ON DOWN WITH THE REST OF THESE BITCHES WAITTNG FOR ME TO MOVE....  NEVA,0
#Israel #raps #Palestinian #U.N. #draft as '#gimmick.' via @user,0
Count the scars on your soul,0
HAPPY is how i can describe today! â˜º ðŸ’œ,0
So happy i havent gone to bed yet,1
@user I'll snap at you if you tell me what to do again!|ðŸ˜‚  #funnyGuy,1
MT Darth Vader is polling higher than all potential 2016 US presidential candidates you surprised?,1
#notcies #eu Moscovici quizzed on extra time for three EU countries to hit eurozone targets,0
So which beauty's can get me some followers thenðŸ™Š,0
"For those who CAN hear us, @user talks about NB Power's record number of outages. 7:13  #transmitterproblems",1
Hold It Bub! >> >> #cartoon #comics #funny #jesus,0
Dang my selfie game is on point when I'm drinking  #actuallysorry,1
@user @user @user #Already dividing One from another!| Good,0
"@user Im sorry chode, my phone broke ;)",0
RT @user Should be great watching Miami try to block Sweat and Featherstone off the edge next two years. Real fun stuff,1
"@user he lost his license not long after, mwahaha  @user",1
This kid right here makes me so happy â¤ï¸ #nephew,0
"@user Aaaaaand to read ""Big Sleep"" because can't get any sleep...",1
@user I just texted you. Now I'm going to sleep-not ignoring,0
Love scooping feed bunks before we can feed calves,1
Another @user  moment. We can't be bothered to fix your broadband problem but would you like to buy an Iphone6 of us! HELL NO!!,1
#034i #100 #Glitter #Inside #Just #Lamp  #Of|Please RT:,0
@user @user @user @user awesome! :),0
long to wait till released CO2 turns up temperature -,0
Hope Tulisa doesn't get a job back on #xfactor next year,0
One more all nighter and the semester is done,0
"Race 5 at Sandown dogs tonight sponsored by ""Dandenong Budgie Club"" |Hope that's a joke.|Love a seat at that table  #nerds #getalife",1
Yay for my family leaving & going to Seneca & leaving me to fend for myself.,1
way to prove that women are more than just breasts & an ass...  ðŸ˜’,1
@user I have the box set of The Complete Steptoe and Son.  That should cheer you up,1
"Went off the road this morning as did my English professor , thank you FSU for your concern for commuters  ðŸ˜’",1
#TeenAnalCasting #Alice Alice and Dana -TLW 3X05 Part 2,0
@user I get paid 4 posting stuff like this on TSU! ||YOU CAN TOO! go to #FOLLOWBACK,0
Can't wait to see all the ig pics of people bragging about what they got  #noonegivesafuck,1
Going to my class #fuckyou important,0
I love it when work tells me they don't need me to come in ðŸ’ðŸ˜‚ðŸ˜­ðŸ˜­ðŸ˜­,1
"@user Arizona Coyotes forge deal with BMW But, relocation!!!",1
@user Presumably you have evidence to back this claim and it's not simply a feeling you have based on your interactions.,1
"@user Personal protection, 2nd amendment. Nothing to see here.  #SMFH",1
@user heh as if @user and average work in the same sentence!,1
@user excited for 2015 its gonna be a good year for music ur gonna smash it #EdðŸŽ¤,0
@user Why does a iPhone purchased at full-price still need a mobile device unlock code to work internationally?  #uncarrier,0
@user I mean that all matter this game,1
"The  of the new JD gym bein right next to a Sayers ""sausage roll with  salad please"" ðŸ˜³",1
".@allanhawco Finally had a chance to watch Doyle finale. Thanks for 6 great seasons. Yes, I cried at the end...",0
RTed that because yeah that totally makes sense,1
We'll that was a great way to start off my morning ðŸ˜€,1
"Giving 200 Cr. Water Subsidy to ""Public"" is a CRIME & Wasting 200 Cr. On Advertisement is DEVELOPMENT...Waah ji waah",0
I liked a @user video from @user 2015 Challenge! Style By Dani,0
I come up with some ridiculous scenarios in my head ðŸ’­,0
"The counter argument... RT @user If OSU lost last night, Baylor would be in & we'd all be talking about benefits of no Big 12 champ.",0
What I learned today??? You can choose to live a fearless life. #iam #fearfree  #fearfull,0
@user always a worthy choice @user @user @user @user,0
#Patriots #report #card: #Grades  #half bad: Tom Brady throws under pressure in the 2nd quarter during Sundays,0
"@user Your not understanding something, does  make you an expert in the field.",0
"A MAN MUST HAVE (3) F's TO GET a A IN LIFE: FORTITUDE, FOCUS, & FINANCES. @user",0
"@user yep, the family of #EricGarner is feeling really joyful right now...  #BlackLivesMatter #ShutItDown",1
"@user I.e., strength in numbers, focused movement, appeal to other countries, use pens and paper, change the way we live drastically.",0
"I'm going to call today's commute ""quality time"" w/ my mini. 1 hour & 40 minutes of ""quality time."" Thanks DC rush hour! #Optimism",1
@user my favourite day of the year !!!!,1
Hahaha! @user enjoying the #selfiestick I got her for Christmas!,0
Love working and be exhausted all the time,1
"Yep, it's exactly what you're thinking... someone called an Ambulance for the former Audi R8...||#Audi #R8 #Carporn",0
@user Your opinions don't affect me. I'm going to keep living my life.,0
: #BlackOnBlackCrime comitted by|#BlackLivesMatter #Protest in #FERGUSON ?| RTs @user,0
For those of you that LOVE this time of year.,1
@user you could probably just call or text her that information. #allcelebritiesarefriends,1
@user You are going to have to explain?,0
"Sony Studio Bosses To Employees: Don't Worry, We'll Be Fine I know I'd feel better.",1
"@user @user Hmmm, Next year we'll be saying, teams that moved from SD to LA.",1
@user - Russell Brand discussed today how much his London mansion is worth..and Marx was married to a baroness  #scum #weak,1
@user @user @user too much of that herb. New trend of potheads contributing to society maybe? Darn that,1
@user wesay Yar her date was good ðŸ˜‰ I guess she(in first meeting)wanted to b seen with a girl or smth(in hindsight I found her mashkook),0
"@user no, not negation. Sometimes, peace is achieved in a way that you accept to be content by a constant searing.",0
Aw thanks mother nature. Merry Christmas to you too!,1
Feeling artsy tonight. #artsy#homealone#vienna#studentlife @ b&e's apartment,0
How could he kill is best friend  #a true #friend,0
"What an Irony! The Police divide us, The Terrorists Unite us! #Terrorism #PoliceBrutality",1
"Thank you to all of the lovely people who come to work sick, or come to eat sick.. I appreciate your germs...",1
Smh never knew something could be 80% halal....Been muslim my whole life but somehow i've learned something new i guess,1
